{
  "schema": "lubarchy.hardware.rule/v1",
  "id": "package.firmware.atheros-bluetooth",
  "description": "Qualcomm Atheros USB Bluetooth controllers handled by the ath3k kernel module (matched by its kernel module aliases; the module declares firmware shipped only by firmware-atheros) -> Debian firmware-atheros from non-free-firmware (ADR-0001). A proposal only; nothing is installed.",
  "priority": 100,
  "match": [
    {
      "usb": {
        "modalias": [
          "usb:v03F0p311Dd*dc*dsc*dp*ic*isc*ip*in*",
          "usb:v0489pE027d*dc*dsc*dp*ic*isc*ip*in*",
          "usb:v0489pE02Cd*dc*dsc*dp*ic*isc*ip*in*",
          "usb:v0489pE036d*dc*dsc*dp*ic*isc*ip*in*",
          "usb:v0489pE03Cd*dc*dsc*dp*ic*isc*ip*in*",
          "usb:v0489pE03Dd*dc*dsc*dp*ic*isc*ip*in*",
          "usb:v0489pE04Dd*dc*dsc*dp*ic*isc*ip*in*",
          "usb:v0489pE04Ed*dc*dsc*dp*ic*isc*ip*in*",
          "usb:v0489pE056d*dc*dsc*dp*ic*isc*ip*in*",
          "usb:v0489pE057d*dc*dsc*dp*ic*isc*ip*in*",
          "usb:v0489pE05Fd*dc*dsc*dp*ic*isc*ip*in*",
          "usb:v0489pE076d*dc*dsc*dp*ic*isc*ip*in*",
          "usb:v0489pE078d*dc*dsc*dp*ic*isc*ip*in*",
          "usb:v0489pE095d*dc*dsc*dp*ic*isc*ip*in*",
          "usb:v04C5p1330d*dc*dsc*dp*ic*isc*ip*in*",
          "usb:v04CAp3004d*dc*dsc*dp*ic*isc*ip*in*",
          "usb:v04CAp3005d*dc*dsc*dp*ic*isc*ip*in*",
          "usb:v04CAp3006d*dc*dsc*dp*ic*isc*ip*in*",
          "usb:v04CAp3007d*dc*dsc*dp*ic*isc*ip*in*",
          "usb:v04CAp3008d*dc*dsc*dp*ic*isc*ip*in*",
          "usb:v04CAp300Bd*dc*dsc*dp*ic*isc*ip*in*",
          "usb:v04CAp300Dd*dc*dsc*dp*ic*isc*ip*in*",
          "usb:v04CAp300Fd*dc*dsc*dp*ic*isc*ip*in*",
          "usb:v04CAp3010d*dc*dsc*dp*ic*isc*ip*in*",
          "usb:v04CAp3014d*dc*dsc*dp*ic*isc*ip*in*",
          "usb:v04CAp3018d*dc*dsc*dp*ic*isc*ip*in*",
          "usb:v04F2pAFF1d*dc*dsc*dp*ic*isc*ip*in*",
          "usb:v0930p0215d*dc*dsc*dp*ic*isc*ip*in*",
          "usb:v0930p0219d*dc*dsc*dp*ic*isc*ip*in*",
          "usb:v0930p021Cd*dc*dsc*dp*ic*isc*ip*in*",
          "usb:v0930p0220d*dc*dsc*dp*ic*isc*ip*in*",
          "usb:v0930p0227d*dc*dsc*dp*ic*isc*ip*in*",
          "usb:v0B05p17D0d*dc*dsc*dp*ic*isc*ip*in*",
          "usb:v0CF3p0036d*dc*dsc*dp*ic*isc*ip*in*",
          "usb:v0CF3p3000d*dc*dsc*dp*ic*isc*ip*in*",
          "usb:v0CF3p3002d*dc*dsc*dp*ic*isc*ip*in*",
          "usb:v0CF3p3004d*dc*dsc*dp*ic*isc*ip*in*",
          "usb:v0CF3p3008d*dc*dsc*dp*ic*isc*ip*in*",
          "usb:v0CF3p311Dd*dc*dsc*dp*ic*isc*ip*in*",
          "usb:v0CF3p311Ed*dc*dsc*dp*ic*isc*ip*in*",
          "usb:v0CF3p311Fd*dc*dsc*dp*ic*isc*ip*in*",
          "usb:v0CF3p3121d*dc*dsc*dp*ic*isc*ip*in*",
          "usb:v0CF3p817Ad*dc*dsc*dp*ic*isc*ip*in*",
          "usb:v0CF3p817Bd*dc*dsc*dp*ic*isc*ip*in*",
          "usb:v0CF3pE003d*dc*dsc*dp*ic*isc*ip*in*",
          "usb:v0CF3pE004d*dc*dsc*dp*ic*isc*ip*in*",
          "usb:v0CF3pE005d*dc*dsc*dp*ic*isc*ip*in*",
          "usb:v0CF3pE006d*dc*dsc*dp*ic*isc*ip*in*",
          "usb:v0CF3pE019d*dc*dsc*dp*ic*isc*ip*in*",
          "usb:v13D3p3304d*dc*dsc*dp*ic*isc*ip*in*",
          "usb:v13D3p3362d*dc*dsc*dp*ic*isc*ip*in*",
          "usb:v13D3p3375d*dc*dsc*dp*ic*isc*ip*in*",
          "usb:v13D3p3393d*dc*dsc*dp*ic*isc*ip*in*",
          "usb:v13D3p3395d*dc*dsc*dp*ic*isc*ip*in*",
          "usb:v13D3p3402d*dc*dsc*dp*ic*isc*ip*in*",
          "usb:v13D3p3408d*dc*dsc*dp*ic*isc*ip*in*",
          "usb:v13D3p3423d*dc*dsc*dp*ic*isc*ip*in*",
          "usb:v13D3p3432d*dc*dsc*dp*ic*isc*ip*in*",
          "usb:v13D3p3472d*dc*dsc*dp*ic*isc*ip*in*",
          "usb:v13D3p3474d*dc*dsc*dp*ic*isc*ip*in*",
          "usb:v13D3p3487d*dc*dsc*dp*ic*isc*ip*in*",
          "usb:v13D3p3490d*dc*dsc*dp*ic*isc*ip*in*"
        ]
      }
    }
  ],
  "effects": {
    "classifications": [
      "bluetooth.controller"
    ],
    "packages": [
      {
        "name": "firmware-atheros",
        "disposition": "require",
        "source": "non-free-firmware",
        "reason": "The ath3k Bluetooth driver requests firmware that Debian ships in firmware-atheros."
      }
    ]
  }
}
